{
  "$schema": "https://json-schema.org/draft/2020-12/schema",
  "$id": "https://github.com/Dokki-lab/dokki-charts/blob/main/skill/schemas/chart.schema.json",
  "title": "Dokki Charts v1",
  "type": "object",
  "additionalProperties": false,
  "required": ["protocol", "title", "chart", "encoding", "data"],
  "properties": {
    "protocol": { "const": "dokki-charts@1" },
    "title": { "type": "string", "minLength": 1, "maxLength": 160 },
    "subtitle": { "type": "string", "maxLength": 240 },
    "chart": {
      "type": "object",
      "additionalProperties": false,
      "required": ["type"],
      "properties": {
        "type": { "enum": ["bar", "line", "area", "dot", "scatter", "donut", "waffle", "heatmap", "waterfall", "timeline", "sankey", "network", "progress", "kpi"] },
        "orientation": { "enum": ["vertical", "horizontal"] }
      }
    },
    "encoding": {
      "type": "object",
      "minProperties": 1,
      "additionalProperties": { "type": "string", "minLength": 1 }
    },
    "data": {
      "type": "array",
      "minItems": 1,
      "maxItems": 5000,
      "items": {
        "type": "object",
        "additionalProperties": { "type": ["string", "number", "boolean", "null"] }
      }
    },
    "insight": { "type": "string", "maxLength": 400 },
    "notes": { "type": "array", "maxItems": 12, "items": { "type": "string", "maxLength": 400 } },
    "sources": {
      "type": "array",
      "maxItems": 20,
      "items": {
        "type": "object",
        "additionalProperties": false,
        "required": ["label"],
        "properties": {
          "label": { "type": "string", "minLength": 1, "maxLength": 200 },
          "url": { "type": "string", "maxLength": 2048 }
        }
      }
    },
    "transformNotes": { "type": "array", "maxItems": 20, "items": { "type": "string", "maxLength": 400 } },
    "numberFormat": { "enum": ["plain", "percent", "currency"] },
    "currency": { "type": "string", "pattern": "^[A-Z]{3}$" },
    "theme": {
      "type": "object",
      "additionalProperties": false,
      "properties": {
        "accent": { "type": "string", "pattern": "^#[0-9A-Fa-f]{6}$" },
        "background": { "type": "string", "pattern": "^#[0-9A-Fa-f]{6}$" },
        "foreground": { "type": "string", "pattern": "^#[0-9A-Fa-f]{6}$" }
      }
    }
  }
}
